{
    "metadata": {
        "title": "OASIS CSDL XML Elements and Attributes Classification",
        "description": "Based on the OASIS OData CSDL XML Representation Version 4.02 specification, Appendix B, this document lists all EDM elements and categorizes their attribute types.",
        "version": "4.02",
        "source": "OASIS OData CSDL XML Representation Version 4.02 specification",
        "appendixUrl": "https://docs.oasis-open.org/odata/odata-csdl-xml/v4.02/csd01/odata-csdl-xml-v4.02-csd01.html#TableofXMLElementsandAttributes",
        "baseUrl": "https://docs.oasis-open.org/odata/odata-csdl-xml/v4.02/csd01/odata-csdl-xml-v4.02-csd01.html"
    },
    "attributeCategories": {
        "basic": {
            "name": "Basic Attribute",
            "description": "Simple value types (strings, booleans, numbers, identifiers)",
            "subcategories": [
                {
                    "name": "MaxLength",
                    "description": "Positive integer or symbolic value",
                    "symbolicValues": [
                        {
                            "name": "max",
                            "description": "shorthand for the maximum length supported by the service"
                        }
                    ]
                },
                {
                    "name": "Scale",
                    "description": "Non-negative integer or symbolic values",
                    "symbolicValues": [
                        {
                            "name": "floating",
                            "description": "decimal floating-point number where precision specifies significant digits (not allowed in OData 4.0 responses)"
                        },
                        {
                            "name": "variable",
                            "description": "number of digits to the right of decimal point can vary from zero to the precision value"
                        }
                    ],
                    "constraints": "Scale value MUST be less than or equal to Precision value",
                    "default": "0 if not specified",
                    "notes": "Services should use lower-case values; clients should accept values case-insensitively"
                },
                {
                    "name": "SRID",
                    "description": "Non-negative integer or symbolic value",
                    "symbolicValues": [
                        {
                            "name": "variable",
                            "description": "allows different spatial reference systems"
                        }
                    ],
                    "default": "0 for Geometry types, 4326 for Geography types if not specified"
                }
            ]
        },
        "reference": {
            "name": "Reference Attribute",
            "description": "References to other model elements represented in XML/JSON as qualified names, type names, target paths, etc. . ",
            "subcategories": [
                {
                    "name": "Absolute Reference",
                    "description": "symbolic references that reference elements anywhere in the model"
                },
                {
                    "name": "Relative Reference",
                    "description": "symbolic references that reference elements relative to a specific ancestor (or related) context element"
                }
            ]
        },
        "path": {
            "name": "Path Attribute",
            "description": "Path expressions in form of a sequence of model elements represented in XML/JSON as a string or element names with delimiters",
            "subcategories": [
                {
                    "name": "Absolute Path",
                    "description": "Paths that are naming elements by starting from the root of the model"
                },
                {
                    "name": "Relative Path",
                    "description": "Paths that are resolved relative to a specific element context"
                }
            ]
        }
    },
    "elementGroups": [
        {
            "name": "Schema Elements",
            "description": "Core schema definition elements",
            "elements": [
                {
                    "name": "edm:Schema",
                    "hasAttributes": true,
                    "attributes": [
                        {
                            "name": "Namespace",
                            "category": "basic",
                            "description": "A simple identifier used to uniquely identify the element within its containing scope.",
                            "subcategory": "simple identifier"
                        },
                        {
                            "name": "Alias",
                            "category": "basic",
                            "subcategory": "simple identifier",
                            "description": "The alias of a schema MAY be used instead of the namespaceto identify model elements of that schema."
                        }
                    ],
                    "ref": "#sec_Schema"
                },
                {
                    "name": "edm:Annotations",
                    "hasAttributes": true,
                    "attributes": [
                        {
                            "name": "Target",
                            "category": "path",
                            "subcategory": "Absolute Path",
                            "description": "target path expression",
                            "context": "can reference any model element"
                        },
                        {
                            "name": "Qualifier",
                            "category": "basic",
                            "subcategory": "simple identifier"
                        }
                    ],
                    "ref": "#sec_Annotations"
                }
            ]
        },
        {
            "name": "Entity Model Elements",
            "description": "Core entity and type definition elements",
            "elements": [
                {
                    "name": "edm:EntityType",
                    "hasAttributes": true,
                    "attributes": [
                        {
                            "name": "Name",
                            "category": "basic",
                            "subcategory": "simple identifier",
                            "description": "The entity typeâ€™s name that MUST be unique within its schema."
                        },
                        {
                            "name": "BaseType",
                            "category": "reference",
                            "subcategory": "Absolute Reference",
                            "description": "qualified name of an edm:EntityType",
                            "ref": "#AttributeBaseType.9.2"
                        },
                        {
                            "name": "Abstract",
                            "category": "basic",
                            "description": "boolean"
                        },
                        {
                            "name": "OpenType",
                            "category": "basic",
                            "description": "boolean"
                        },
                        {
                            "name": "HasStream",
                            "category": "basic",
                            "description": "boolean"
                        }
                    ],
                    "ref": "#sec_EntityType"
                },
                {
                    "name": "edm:Key",
                    "hasAttributes": false,
                    "attributes": [],
                    "ref": "#sec_Key"
                },
                {
                    "name": "edm:PropertyRef",
                    "hasAttributes": true,
                    "attributes": [
                        {
                            "name": "Name",
                            "category": "path",
                            "subcategory": "Relative Path",
                            "description": "path to structural property",
                            "context": "relative to the containing entity/complex type"
                        },
                        {
                            "name": "Alias",
                            "category": "basic",
                            "subcategory": "simple identifier"
                        }
                    ],
                    "ref": "#sec_PropertyRef"
                },
                {
                    "name": "edm:Property",
                    "hasAttributes": true,
                    "attributes": [
                        {
                            "name": "Name",
                            "category": "basic",
                            "subcategory": "simple identifier"
                        },
                        {
                            "name": "Type",
                            "category": "reference",
                            "description": "qualified type name or collection",
                            "ref": "#sec_Type"
                        },
                        {
                            "name": "Nullable",
                            "category": "basic",
                            "description": "boolean"
                        },
                        {
                            "name": "DefaultValue",
                            "category": "basic",
                            "description": "primitive value"
                        }
                    ],
                    "ref": "#sec_Property"
                },
                {
                    "name": "edm:NavigationProperty",
                    "hasAttributes": true,
                    "attributes": [
                        {